### DISCUSSION TITLE
browser admin deploy problem

### DISCUSSION THREAD

**Discussion by DavidB-123** [skarl/bose-soundtouch-resurrect#159] [General]
After the successful resolver install, I ran the admin/deploy.sh which seemed to work well until at the end I get the error message:

=== Verifying admin shell at http://192.168.1.112:8181/ ===
curl: (7) Failed to connect to 192.168.1.112 port 8181 after 5 ms: Couldn't connect to server
error: no response from http://192.168.1.112:8181/

I ran the verify.sh which showed the following:
...
=== Admin CGIs (skipped if not deployed) ===
  [ OK ] presets CGI returns ok-envelope
  [SKIP] refresh-all CGI not deployed
  [ OK ] tunein CGI returns JSON or array

=== 0.4 settings surface (skipped if admin not deployed) ===
  [FAIL] speaker proxy /networkInfo returns parseable XML
  [FAIL] speaker proxy /bass returns parseable XML
  [FAIL] speaker proxy /bluetoothInfo carries BluetoothMACAddress

=== 0.4 admin shell + assets (skipped if not deployed) ===
  [ OK ] admin index hosts the four-zone shell (.shell-header)
  [ OK ] Geist 400 woff2 served on /fonts/Geist-400.woff2

=== 0.3 WS + speaker proxy probes ===
  [ OK ] WS port 8080 returns 101 Switching Protocols
  [ OK ] WS response carries Sec-WebSocket-Protocol: gabbo
  [SKIP] speaker proxy not deployed (skipping 0.3 proxy probes)

=== Summary: 25 ok, 3 failed ===

Of course, I cannot connect the ST via browser http://...:8181. A reboot of the ST doesn't help.

**Comment by skarl** [comment]
Hey @DavidB-123 — first off, glad the resolver install came together! And thanks for catching this next one — the admin SPA path got way less mileage with external testers than the resolver did, so anything you hit here is genuinely useful to find.

I've got a couple of running theories for what's going on, but they pull in different directions and I don't want to send you on a wild goose chase. There's one diagnostic block that would tell us which it is — read-only, no reboots, won't touch any settings or playback. It just inspects what processes are running, what's bound to port 8181, what your firewall looks like, and the per-model Shepherd config (the SoundTouch 20 — variant `spotty` — declares a different set of stock daemons than the ST 10, so there might be a port conflict I can't see from my own hardware).

From the folder where you cloned the repo:

```sh
./scripts/ssh-speaker.sh <your-speaker-ip> '
  echo "=== variant + firmware ==="
  curl -s http://localhost:8090/info | grep -oE "<(variant|softwareVersion)>[^<]+</(variant|softwareVersion)>" | head -3

  echo
  echo "=== listeners on 8181 / 8080 / 8090 ==="
  netstat -ltn | grep -E ":(8181|8080|8090) "

  echo
  echo "=== httpd processes ==="
  ps | grep "/bin/httpd" | grep -v grep

  echo
  echo "=== Our shepherd-resolver.xml ==="
  cat /mnt/nv/shepherd/Shepherd-resolver.xml

  echo
  echo "=== Stock per-variant Shepherd config (will be Shepherd-spotty.xml for ST 20) ==="
  ls /opt/Bose/etc/Shepherd-*.xml
  echo "---"
  cat /opt/Bose/etc/Shepherd-spotty.xml 2>/dev/null || echo "(Shepherd-spotty.xml not present on this speaker)"

  echo
  echo "=== Shepherd override dir contents ==="
  ls -la /mnt/nv/shepherd/

  echo
  echo "=== iptables INPUT chain ==="
  iptables -L INPUT -n

  echo
  echo "=== Speaker reaching its own 8181 (loopback) ==="
  curl -sS -o /dev/null -w "HTTP %{http_code} in %{time_total}s\n" --max-time 5 http://127.0.0.1:8181/ || true

  echo
  echo "=== Recent log lines for httpd / shepherd / port 8181 (blank means no matches) ==="
  tail -300 /var/log/messages 2>/dev/null | grep -iE "httpd|shepherd|8181|bind" | tail -20
'
```

Just paste the whole thing back here. The output should be around 50 lines and is intentionally filtered to skip identifiers — no MAC, no serial number, no tokens. If anything in there looks too local-network-specific for your taste, scrub it before posting and I'll work with what's left.

One extra thing that would help if it's easy: when you ran `admin/deploy.sh`, was the speaker in idle / standby before you started, or was it actively playing something? And was the laptop you ran the deploy from on the same Wi-Fi as the speaker, on Ethernet, on a VPN, or on a Wi-Fi extender / mesh segment? Asking because one of my theories needs to know the answer to that.

Cheers, and thanks again — this kind of report on a model I can't poke at directly is what makes the project actually portable instead of just-works-on-my-bench.

**Comment by DavidB-123** [comment]
Hi @skarl, thanks for the prompt reply (as always). I ran the code you posted, here's the output:

```
=== variant + firmware ===
<softwareVersion>27.0.6.46330.5043500 epdbuild.trunk.hepdswbld04.2022-08-04T11:20:29</softwareVersion>
<softwareVersion>I2014102015199423; B201306111041 081008C 2014102015199423</softwareVersion>
<variant>taigan</variant>

=== listeners on 8181 / 8080 / 8090 ===
tcp        0      0 0.0.0.0:8080            0.0.0.0:*               LISTEN      
tcp        0      0 0.0.0.0:8181            0.0.0.0:*               LISTEN      
tcp        0      0 0.0.0.0:8090            0.0.0.0:*               LISTEN      
netstat: /proc/net/tcp6: No such file or directory

=== httpd processes ===
 1830 root       0:01 /bin/httpd -f -p 0.0.0.0:8181 -h /mnt/nv/resolver

=== Our shepherd-resolver.xml ===
<ShepherdConfig>
  <daemon name="/bin/httpd">
    <arg>-f</arg>
    <arg>-p</arg>
    <arg>0.0.0.0:8181</arg>
    <arg>-h</arg>
    <arg>/mnt/nv/resolver</arg>
  </daemon>
</ShepherdConfig>

=== Stock per-variant Shepherd config (will be Shepherd-spotty.xml for ST 20) ===
/opt/Bose/etc/Shepherd-mojo.xml
/opt/Bose/etc/Shepherd-noncore.xml
/opt/Bose/etc/Shepherd-spotty.xml
/opt/Bose/etc/Shepherd-taigan.xml
---
<ShepherdConfig>
  <daemon name="LegacyProduct"/>
  <daemon name="scmmond">
    <arg>--sm1</arg>
    <arg>--amp-faults</arg>
    <arg>--dc-offset</arg>
  </daemon>

  <daemon name="APServer"
          recovery="reboot"
          nice="-6">
    <arg>-c</arg>
    <arg>/opt/Bose/etc/APConfig-spotty.xml</arg>
  </daemon>

  <daemon name="UpnpSource">
    <arg>-c/opt/Bose/etc/UpnpSource-spotty.xml</arg>
  </daemon>

  <daemon name="WebServer">
    <arg>-c/opt/Bose/etc/WebServer-spotty.xml</arg>
  </daemon>

  <daemon name="PtsServer">
    <arg>/opt/Bose/pts-handler</arg>
    <arg>82</arg>
  </daemon>

  <daemon name="BoseApp"
          recovery="reboot">
    <arg>-c/opt/Bose/etc/BoseApp-spotty.xml</arg>
  </daemon>

  <daemon name="NetManager"
          recovery="reboot"/>

  <daemon name="SoftwareUpdate"
          recovery="ignore"/>

  <daemon name="scm_finalize"
          recovery="ignore"/>

  <daemon name="CLIServer"/>
</ShepherdConfig>

=== Shepherd override dir contents ===
total 8
drwxr-xr-x    2 root     root           624 May 18 05:59 .
drwxr-xr-x    8 root     root           896 May 18 05:59 ..
lrwxrwxrwx    1 root     root            31 May 17 20:58 Shepherd-mojo.xml -> /opt/Bose/etc/Shepherd-mojo.xml
lrwxrwxrwx    1 root     root            34 May 17 20:58 Shepherd-noncore.xml -> /opt/Bose/etc/Shepherd-noncore.xml
-rw-r--r--    1 root     root           190 May 17 20:58 Shepherd-resolver.xml
lrwxrwxrwx    1 root     root            33 May 17 20:58 Shepherd-spotty.xml -> /opt/Bose/etc/Shepherd-spotty.xml
lrwxrwxrwx    1 root     root            33 May 17 20:58 Shepherd-taigan.xml -> /opt/Bose/etc/Shepherd-taigan.xml
-rw-r--r--    1 root     root           247 May 18 05:59 pids

=== iptables INPUT chain ===
Chain INPUT (policy ACCEPT)
target     prot opt source               destination         

=== Speaker reaching its own 8181 (loopback) ===
HTTP 200 in 0.042s

=== Recent log lines for httpd / shepherd / port 8181 (blank means no matches) ===`
```

I believe the ST20 was in standby when I ran the admin/deploy.sh. The ST20 is connected to the main WiFi router, the machine from where I run the scripts is a Live LinuxMint connected via Ethernet to a second router which is connected via cable to the main router. If needed, I could also connect the Linux PC to the same WiFi. - Hope this helps in narrowing down the problem. Let me know if I can do anything else to help.

**Comment by skarl** [comment]
Hey @DavidB-123 — speaker is in great shape (`/bin/httpd` bound to `0.0.0.0:8181`, no firewall on it, loopback works), so the block has to be between your laptop and the speaker on port 8181 specifically. Rather than send you on more pure-diagnostic asks, let's combine it with a potential live workaround.

The idea: temporarily stand up a *second* busybox httpd on the speaker, on a different port that's almost certainly not filtered anywhere, serving the same admin SPA. It runs alongside the real one (no edits to anything on disk, nothing persistent). If you can reach it from your browser, we've found both the answer and a working escape hatch.

**Try it:**

```sh
./scripts/ssh-speaker.sh <your-speaker-ip> '/bin/httpd -f -p 0.0.0.0:28181 -h /mnt/nv/resolver'
```

That command will sit in your terminal, holding the httpd in the foreground (no prompt comes back — that's normal). While it's running, open this in your browser on the same laptop:

```
http://<your-speaker-ip>:28181/
```

Three possible outcomes:

1. **Admin SPA loads and works fully** (now playing, presets, browse, etc.) → confirmed: port 8181 is the only thing blocked on your network. We'll ship a `--port` option in `scripts/deploy.sh` so you and anyone else in the same situation can pick a different one; you'd then re-deploy and the admin would live on the new port permanently.
2. **Same "couldn't connect" error you got on 8181** → port 8181 isn't uniquely targeted, the block is broader. We'll keep digging.
3. **SPA loads but some functionality is broken** (e.g. WebSocket can't connect) → most-likely-cause, since the WS still goes to port 8080. Tell me what's broken and we'll work through it.

When you're done, Ctrl-C in the SSH terminal — that kills the test httpd and the speaker goes back exactly to how it was. Nothing to clean up.

One extra ask only if outcome (2) hits — paste this from your laptop:

```sh
curl -sv --max-time 5 http://<your-speaker-ip>:8090/info  2>&1 | tail -10
echo "==="
curl -sv --max-time 5 http://<your-speaker-ip>:8181/      2>&1 | tail -10
echo "==="
curl -sv --max-time 5 http://<your-speaker-ip>:28181/     2>&1 | tail -10
```

The `-v` outputs side-by-side tell me exactly *how* each port fails (TCP reset, ICMP unreachable, timeout each look different) which narrows the diagnosis further.

Cheers, and thanks again for sticking with this.

**Reply by DavidB-123** [reply]
Hi @skarl, unfortunately, the second busybox didn't work either; still unable to connect to the server at port :28181. I also tried to reach the speaker on both ports 8181 and 28181 via the browser on my mobile which is connected to the same WiFi as the speaker - same result.

Here is the output from your commands above:

```
< Expires: Thu, 26 Oct 1995 00:00:00 GMT
< Transfer-Encoding: chunked
< Server: Allegro-Software-RomPager/5.40b1
< Access-Control-Allow-Origin: http://192.168.1.112
< Access-Control-Allow-Headers: Content-Type
< Connection: close
< 
{ [1259 bytes data]
* Closing connection
<?xml version="1.0" encoding="UTF-8" ?><info deviceID="08DF1F132C27"><name>MyBose</name><type>SoundTouch Portable</type><margeAccountUUID>306xxxx</margeAccountUUID><components><component><componentCategory>SCM</componentCategory><softwareVersion>27.0.6.46330.5043500 epdbuild.trunk.hepdswbld04.2022-08-04T11:20:29</softwareVersion><serialNumber>K4238xxxxxxxxxxxxxxxxxx</serialNumber></component><component><componentCategory>PackagedProduct</componentCategory><serialNumber>06680xxxxxxxxxxxx</serialNumber></component><component><componentCategory>Lightswitch</componentCategory><serialNumber></serialNumber></component><component><componentCategory>SMSC</componentCategory><softwareVersion>I2014102015199423; B201306111041 081008C 2014102015199423</softwareVersion><serialNumber>08DF1F132C2C</serialNumber></component></components><margeURL>http://127.0.0.1:8181/marge</margeURL><networkInfo type="SCM"><macAddress>08DF1F132C27</macAddress><ipAddress>192.168.1.112</ipAddress></networkInfo><networkInfo type="SMSC"><macAddress>08DF1F132C2C</macAddress><ipAddress>192.168.1.112</ipAddress></networkInfo><moduleType>scm</moduleType><variant>taigan</variant><variantMode>normal</variantMode><countryCode>EU</countryCode><regionCode></regionCode></info>===
*   Trying 192.168.1.112:8181...
* connect to 192.168.1.112 port 8181 from 192.168.0.123 port 35598 failed: Connection refused
* Failed to connect to 192.168.1.112 port 8181 after 2 ms: Couldn't connect to server
* Closing connection
===
*   Trying 192.168.1.112:28181...
* connect to 192.168.1.112 port 28181 from 192.168.0.123 port 41840 failed: Connection refused
* Failed to connect to 192.168.1.112 port 28181 after 2 ms: Couldn't connect to server
* Closing connection
```

Sorry to keep you busy with this. I hope when we solve this, it will be helpful to other folks in the same situation.

One more thing:
Today, I noted the SoundTouch audio stream (from a radio preset), after playing a while, became  "laggy" and suddenly the speaker did a reboot. Very strange behavior. Not sure if this is related to the installed resolver or admin (I didn't uninstall it).

**Reply by skarl** [reply]
Hey @DavidB-123 — first, real respect for going the extra mile with the mobile test. That one ruled out about four hypotheses I had stacked up, which is more progress than my last reply produced. Thank you.

I'll be honest with you: at this point I'm a bit stuck. This isn't a failure mode I've seen before, and it doesn't quite line up with how Linux networking is supposed to behave on paper — your speaker says it's listening on `0.0.0.0:8181`, the firewall is empty, loopback works, port 8090 right next to it works fine from the same laptop on the same wire, but 8181 and a freshly-chosen alt-port 28181 both get an immediate RST from anywhere external, even from a phone on the speaker's own Wi-Fi. By the textbook, that shouldn't be possible. So *something* I haven't looked at yet on your speaker is intercepting connections to those ports before they reach the listening socket.

If I had your speaker on my desk this would probably take ten minutes with `tcpdump` and a couple of `iptables` dumps to nail down. Remotely, it's a lot slower because I have to guess at which corner to look in. I'm not a deep networking expert either, so we're going to work through this step by step — but I'm happy to keep going as long as you are.

One more block of diagnostics — this is wider than the last one because I want to cover the chains I missed before. Read-only, won't change anything:

```sh
./scripts/ssh-speaker.sh <your-speaker-ip> '
  echo "=== iptables — filter (already saw INPUT, this adds FORWARD + OUTPUT) ==="
  iptables -L -n -v -t filter

  echo
  echo "=== iptables — NAT table (PREROUTING / OUTPUT / POSTROUTING) ==="
  iptables -L -n -v -t nat 2>&1

  echo
  echo "=== iptables — mangle table ==="
  iptables -L -n -v -t mangle 2>&1

  echo
  echo "=== iptables — raw table ==="
  iptables -L -n -v -t raw 2>&1

  echo
  echo "=== Routing table ==="
  ip route show

  echo
  echo "=== Routing policy rules ==="
  ip rule show

  echo
  echo "=== Speaker reaching its OWN public IP on 8181 (not loopback) ==="
  MY_IP=$(ip -4 -br addr show 2>/dev/null | awk "{print \$3}" | head -1 | cut -d/ -f1)
  echo "  Probing self-IP: $MY_IP"
  curl -sv --max-time 5 http://$MY_IP:8181/    2>&1 | tail -8
  echo "---"
  curl -sv --max-time 5 http://$MY_IP:8090/info 2>&1 | tail -8

  echo
  echo "=== Network-namespace check (compare httpd vs BoseApp) ==="
  HTTPD_PID=$(pgrep -f "/bin/httpd" | head -1)
  BOSE_PID=$(pgrep -f "BoseApp" | head -1)
  echo "  httpd PID:    $HTTPD_PID"
  echo "  BoseApp PID:  $BOSE_PID"
  ls -L /proc/$HTTPD_PID/ns/net 2>&1
  ls -L /proc/$BOSE_PID/ns/net  2>&1

  echo
  echo "=== /proc/net/tcp filtered for port 8181 (hex 1FF5) ==="
  awk "\$2 ~ /:1FF5\$/ || \$3 ~ /:1FF5\$/ {print}" /proc/net/tcp
'
```

What I'm hoping to find: a hidden NAT/mangle/raw rule, a policy-routing rule, or a network-namespace difference between our httpd and BoseApp. Any of those would explain the symptom; none of them are visible in what we've already collected.

The "speaker reaching its own public IP" sub-test is the single most informative line in there: if your speaker can curl `http://<its-own-LAN-IP>:8181/` and get HTTP 200, it tells us the listening side is healthy and the problem is purely about packets coming in from outside; if even that fails, the listening side has a defect we can't currently see.

About the self-reboot you mentioned during playback — I don't have enough information to know whether that's related to any of this or a separate issue entirely, so let's set it aside for now and come back to it once we have the admin reachable. If it keeps happening, let me know.

Cheers, and thanks for the patience.

**Reply by DavidB-123** [reply]
Hi @skarl , thanks for your patience with this as well. I ran your script and here is the output. 

```
=== iptables — filter (already saw INPUT, this adds FORWARD + OUTPUT) ===
Chain INPUT (policy ACCEPT 47M packets, 2499M bytes)
 pkts bytes target     prot opt in     out     source               destination         

Chain FORWARD (policy ACCEPT 0 packets, 0 bytes)
 pkts bytes target     prot opt in     out     source               destination         

Chain OUTPUT (policy ACCEPT 47M packets, 2400M bytes)
 pkts bytes target     prot opt in     out     source               destination         

=== iptables — NAT table (PREROUTING / OUTPUT / POSTROUTING) ===
Chain PREROUTING (policy ACCEPT 25398 packets, 5631K bytes)
 pkts bytes target     prot opt in     out     source               destination         

Chain INPUT (policy ACCEPT 7404 packets, 2890K bytes)
 pkts bytes target     prot opt in     out     source               destination         

Chain OUTPUT (policy ACCEPT 23M packets, 1409M bytes)
 pkts bytes target     prot opt in     out     source               destination         

Chain POSTROUTING (policy ACCEPT 23M packets, 1409M bytes)
 pkts bytes target     prot opt in     out     source               destination         

=== iptables — mangle table ===
iptables v1.4.21: can't initialize iptables table `mangle': Table does not exist (do you need to insmod?)
Perhaps iptables or your kernel needs to be upgraded.

=== iptables — raw table ===
Chain PREROUTING (policy ACCEPT 47M packets, 2502M bytes)
 pkts bytes target     prot opt in     out     source               destination         

Chain OUTPUT (policy ACCEPT 47M packets, 2400M bytes)
 pkts bytes target     prot opt in     out     source               destination         

=== Routing table ===
default via 192.168.1.1 dev eth0 
192.168.1.0/24 dev eth0  proto kernel  scope link  src 192.168.1.112 
203.0.113.0/30 dev usb0  proto kernel  scope link  src 203.0.113.1 

=== Routing policy rules ===

=== Speaker reaching its OWN public IP on 8181 (not loopback) ===
RTNETLINK answers: Operation not supported
Dump terminated
  Probing self-IP: 
* getaddrinfo(3) failed for :8181
* Couldn't resolve host ''
* Closing connection 0
---
* getaddrinfo(3) failed for :8090
* Couldn't resolve host ''
* Closing connection 0

=== Network-namespace check (compare httpd vs BoseApp) ===
  httpd PID:    1859
  BoseApp PID:  1850
/proc/1859/ns/net
/proc/1850/ns/net

=== /proc/net/tcp filtered for port 8181 (hex 1FF5) ===
   9: 00000000:1FF5 00000000:0000 0A 00000000:00000000 00:00000000 00000000     0        0 3170 1 c4488a00 100 0 0 10 0                              
  62: 0100007F:1FF5 0100007F:EE20 06 00000000:00000000 03:000006B7 00000000     0        0 0 3 c43b9100                                              
  84: 0100007F:1FF5 0100007F:EE23 06 00000000:00000000 03:000006BD 00000000     0        0 0 3 c43b9d00                                              
  97: 0100007F:EE22 0100007F:1FF5 06 00000000:00000000 03:000006BB 00000000     0        0 0 3 c43b9c00    
```
I noted something didn't work as intended in the part "Speaker reaching its OWN public IP on 8181" (missing IP). When I tried running `ip -4 -br addr show` on the speaker (ssh) I got the error that option "-br" is unknown. I checked with `ip -V` and it came back with `ip utility, iproute2-ss131122`. Probably an old version on the speaker? Running `ip -4 addr show` gave this:
```
1: lo: <LOOPBACK,UP,LOWER_UP> mtu 65536 qdisc noqueue state UNKNOWN group default 
    inet 127.0.0.1/8 scope host lo
       valid_lft forever preferred_lft forever
4: usb0: <NO-CARRIER,BROADCAST,MULTICAST,UP> mtu 1500 qdisc pfifo_fast state DOWN group default qlen 1000
    inet 203.0.113.1/30 scope global usb0
       valid_lft forever preferred_lft forever
5: eth0: <BROADCAST,MULTICAST,UP,LOWER_UP> mtu 1500 qdisc pfifo_fast state UP group default qlen 1000
    inet 192.168.1.112/24 scope global eth0
       valid_lft forever preferred_lft forever
```
I then picked the first IP and put it directly in your script above as `MY_IP=127.0.0.1`  and ran it again. This is what came back (skipping the first part):

````
=== Speaker reaching its OWN public IP on 8181 (not loopback) ===
  Probing self-IP: 127.0.0.1
        <p class="boot">Loading admin...</p>
      </main>
      <div class="shell-mini" hidden></div>
      <nav class="shell-tabs" aria-label="primary"></nav>
    </div>
    <script type="module" src="app/main.js?v=unknown"></script>
  </body>
</html>
---
< Access-Control-Allow-Origin: http://127.0.0.1
< Access-Control-Allow-Headers: Content-Type
< Connection: close
< 
{ [1273 bytes data]
* Curl_http_done: called premature == 0
* Closing connection 0
<?xml version="1.0" encoding="UTF-8" ?><info deviceID="08DF1F132C27"><name>Sweetheart Bose</name><type>SoundTouch Portable</type><margeAccountUUID>3067402</margeAccountUUID><components><component><componentCategory>SCM</componentCategory><softwareVersion>27.0.6.46330.5043500 epdbuild.trunk.hepdswbld04.2022-08-04T11:20:29</softwareVersion><serialNumber>K4238426601625125000710</serialNumber></component><component><componentCategory>PackagedProduct</componentCategory><serialNumber>066801942460178AE</serialNumber></component><component><componentCategory>Lightswitch</componentCategory><serialNumber></serialNumber></component><component><componentCategory>SMSC</componentCategory><softwareVersion>I2014102015199423; B201306111041 081008C 2014102015199423</softwareVersion><serialNumber>08DF1F132C2C</serialNumber></component></components><margeURL>http://127.0.0.1:8181/marge</margeURL><networkInfo type="SCM"><macAddress>08DF1F132C27</macAddress><ipAddress>192.168.1.112</ipAddress></networkInfo><networkInfo type="SMSC"><macAddress>08DF1F132C2C</macAddress><ipAddress>192.168.1.112</ipAddress></networkInfo><moduleType>scm</moduleType><variant>taigan</variant><variantMode>normal</variantMode><countryCode>EU</countryCode><regionCode></regionCode></info>
=== Network-namespace check (compare httpd vs BoseApp) ===
  httpd PID:    1859
  BoseApp PID:  1850
/proc/1859/ns/net
/proc/1850/ns/net

=== /proc/net/tcp filtered for port 8181 (hex 1FF5) ===
   9: 00000000:1FF5 00000000:0000 0A 00000000:00000000 00:00000000 00000000     0        0 3170 1 c4488a00 100 0 0 10 0                              
  56: 0100007F:C28F 0100007F:1FF5 06 00000000:00000000 03:0000175B 00000000     0        0 0 3 c43b9e00                                              
  67: 0100007F:B6FE 0100007F:1FF5 06 00000000:00000000 03:000012CB 00000000     0        0 0 3 c43b9c00                                              
  89: 0100007F:1FF5 0100007F:B700 06 00000000:00000000 03:000012CD 00000000     0        0 0 3 c43b9280                                              
 110: 0100007F:1FF5 0100007F:B6FD 06 00000000:00000000 03:000012C9 00000000     0        0 0 3 c43b9100               
```

I hope this helps narrowing it down. :-)
BR

**Reply by skarl** [reply]
Hey @DavidB-123 — thanks for running that. Apologies for one bug on my end: the `ip -br` flag I used isn't supported by your speaker's older iproute2, so `MY_IP` came out empty and the most important sub-test (speaker curling its own LAN IP) ended up retesting loopback instead. Loopback we already knew worked. That's the test I actually need data from.

Three things this time, all read-only:

```sh
./scripts/ssh-speaker.sh <your-speaker-ip> '
  echo "=== Speaker curling its own LAN IP on 8181 ==="
  curl -sv --max-time 5 http://192.168.1.112:8181/ 2>&1 | tail -10

  echo
  echo "=== Network namespace inodes (httpd vs BoseApp) ==="
  HTTPD_PID=$(pgrep -f "/bin/httpd" | head -1)
  BOSE_PID=$(pgrep -f "BoseApp" | head -1)
  echo "httpd ($HTTPD_PID): $(readlink /proc/$HTTPD_PID/ns/net)"
  echo "BoseApp ($BOSE_PID): $(readlink /proc/$BOSE_PID/ns/net)"
'
```

And one more — a two-terminal `tcpdump` test that'll tell us definitively whether your laptop's SYN even arrives at the speaker's external interface, or gets dropped somewhere on the way.

Terminal A — ssh into the speaker, start the capture:

```sh
./scripts/ssh-speaker.sh <your-speaker-ip> 'tcpdump -i eth0 -nn port 8181 or port 8090 -c 10'
```

Terminal B — laptop, fire two curls back-to-back:

```sh
curl -sv --max-time 5 http://192.168.1.112:8090/info 2>&1 | tail -3
curl -sv --max-time 5 http://192.168.1.112:8181/    2>&1 | tail -3
```

`tcpdump` exits on its own after 10 packets (or you can Ctrl-C earlier). Paste whatever it captured.

Three possible patterns it could show:

- **8090 SYN arrives at eth0 + a reply leaves, 8181 SYN never arrives.** Something between your laptop and the speaker drops 8181 outbound (laptop stack, intermediate device). We'd then look upstream.
- **Both SYNs arrive, 8181 gets a RST out from the speaker.** The kernel itself is rejecting on 8181. Combined with the namespace inodes above, this would likely point at a socket-binding or namespace difference for our daemon vs. BoseApp.
- **Both SYNs arrive, no reply at all to 8181.** Packets silently dropped before the socket. A different diagnosis again.

Whichever of the three we see narrows the remaining options sharply.

Cheers m8. =)

**Reply by DavidB-123** [reply]
Hi @skarl, thanks again. OK I ran the first script and this came back (guess this looks good?):

```
=== Speaker curling its own LAN IP on 8181 ===
      <header class="shell-header"></header>
      <main id="app" class="shell-body" aria-busy="true">
        <p class="boot">Loading admin...</p>
      </main>
      <div class="shell-mini" hidden></div>
      <nav class="shell-tabs" aria-label="primary"></nav>
    </div>
    <script type="module" src="app/main.js?v=unknown"></script>
  </body>
</html>

=== Network namespace inodes (httpd vs BoseApp) ===
httpd (1859): net:[4026534188]
BoseApp (1850): net:[4026534188]
```
Now the tcpdump: I ran it a few times and found that the 8090 results already in 12 packets, so I increased the cutoff to 15 to make sure we don't miss anything and ran it twice until 15 packets received. Looks like nothing on 8181 :-/

```
tcpdump: verbose output suppressed, use -v or -vv for full protocol decode
listening on eth0, link-type EN10MB (Ethernet), capture size 65535 bytes
04:22:38.078180 IP 192.168.1.114.54542 > 192.168.1.112.8090: Flags [S], seq 2410545890, win 64240, options [mss 1460,sackOK,TS val 1825922520 ecr 0,nop,wscale 7], length 0
04:22:38.078520 IP 192.168.1.112.8090 > 192.168.1.114.54542: Flags [S.], seq 1029757027, ack 2410545891, win 10136, options [mss 1460,sackOK,TS val 18105807 ecr 1825922520,nop,wscale 2], length 0
04:22:38.081478 IP 192.168.1.114.54542 > 192.168.1.112.8090: Flags [.], ack 1, win 502, options [nop,nop,TS val 1825922526 ecr 18105807], length 0
04:22:38.081991 IP 192.168.1.114.54542 > 192.168.1.112.8090: Flags [P.], seq 1:86, ack 1, win 502, options [nop,nop,TS val 1825922526 ecr 18105807], length 85
04:22:38.082104 IP 192.168.1.112.8090 > 192.168.1.114.54542: Flags [.], ack 86, win 2513, options [nop,nop,TS val 18105808 ecr 1825922526], length 0
04:22:38.090889 IP 192.168.1.112.8090 > 192.168.1.114.54542: Flags [P.], seq 1:346, ack 86, win 2513, options [nop,nop,TS val 18105809 ecr 1825922526], length 345
04:22:38.091310 IP 192.168.1.112.8090 > 192.168.1.114.54542: Flags [P.], seq 346:1619, ack 86, win 2513, options [nop,nop,TS val 18105809 ecr 1825922526], length 1273
04:22:38.095504 IP 192.168.1.114.54542 > 192.168.1.112.8090: Flags [.], ack 346, win 500, options [nop,nop,TS val 1825922540 ecr 18105809], length 0
04:22:38.095796 IP 192.168.1.114.54542 > 192.168.1.112.8090: Flags [.], ack 1619, win 491, options [nop,nop,TS val 1825922540 ecr 18105809], length 0
04:22:38.096089 IP 192.168.1.114.54542 > 192.168.1.112.8090: Flags [F.], seq 86, ack 1619, win 491, options [nop,nop,TS val 1825922540 ecr 18105809], length 0
04:22:38.110146 IP 192.168.1.112.8090 > 192.168.1.114.54542: Flags [F.], seq 1619, ack 87, win 2513, options [nop,nop,TS val 18105810 ecr 1825922540], length 0
04:22:38.113016 IP 192.168.1.114.54542 > 192.168.1.112.8090: Flags [.], ack 1620, win 491, options [nop,nop,TS val 1825922558 ecr 18105810], length 0
04:22:55.773527 IP 192.168.1.114.55446 > 192.168.1.112.8090: Flags [S], seq 1838809013, win 64240, options [mss 1460,sackOK,TS val 1825940216 ecr 0,nop,wscale 7], length 0
04:22:55.773843 IP 192.168.1.112.8090 > 192.168.1.114.55446: Flags [S.], seq 1523145439, ack 1838809014, win 10136, options [mss 1460,sackOK,TS val 18107577 ecr 1825940216,nop,wscale 2], length 0
04:22:55.776392 IP 192.168.1.114.55446 > 192.168.1.112.8090: Flags [.], ack 1, win 502, options [nop,nop,TS val 1825940221 ecr 18107577], length 0
15 packets captured
24 packets received by filter
0 packets dropped by kernel
```

**Reply by skarl** [reply]
Hey @DavidB-123 — quick correction on my last reply: since both 8181 *and* 28181 failed (including from the phone on the speaker's Wi-Fi), the block isn't just one port. It looks more like your router has a small allowlist of well-known ports between LAN clients and drops the rest. So just picking a different port for the admin only helps if we happen to pick one that's on that allowlist.

Three small things would tell us a lot — none of them invasive, and you can stop at the first one if it gives a clear answer.

**1) Try a handful of well-known alt-HTTP ports.** Same two-terminal trick as before.

Terminal A — ssh into the speaker, listen on a port:

```sh
./scripts/ssh-speaker.sh <your-speaker-ip> 'nc -l -p 8000'
```

Terminal B — laptop, try to reach it:

```sh
curl -sv --max-time 5 http://<your-speaker-ip>:8000/ 2>&1 | tail -5
```

"Connected to … port 8000" followed by "Empty reply from server" = the port works. "Failed to connect after N ms" = blocked.

Repeat for `8443`, then `9000`. If any of those connect, we have a port that pierces whichever filter is in play, and the `--port` flag I want to add to the deploy is the fix. If they all fail, your router's allowlist is short enough that the fix has to be on the router side.

**2) What's the brand and model of the router the speaker is connected to** (the main router, not the second one)? If you can share it, I can look up that specific model — some consumer router vendors are known to filter alt-HTTP ports between LAN clients by default, and we might find the exact knob just by knowing what we're looking at.

**3) If you're comfortable poking around in the router's admin UI**, things worth checking — these go by different names depending on the brand:

- **AP isolation / Client isolation / Wireless isolation** (often a Wi-Fi setting) — if it's on, that's the most likely culprit
- **Access Control / Outbound filtering / Port filters** — any explicit rules listed?
- **Parental Controls / IPS / Security suite** (AiProtection on Asus, similar on others) — any of those enabled?
- What port the router admin UI itself listens on — if it happens to be 8181, that's an interesting datapoint

Whichever of these you have time for is appreciated. The first one is the cheapest and most informative single ask if you only do one.

Have a great day!

**Reply by DavidB-123** [reply]
Hi @skarl, all these ports failed to connect with the method you described. The PC is in the same WLAN as the speaker. The router has two WLANs (2.4 and 5 GHz) and when I noticed PC and speaker were connected to different frequencies, I turned one off to force both on the same frequency. But no luck. I guess there must be a port filter between devices connected to the router but I could not locate any settings for that. Port forwarding and firewall only control traffic to/from extern, correct? 

 I played with `nc -z <speaker-IP> 8000-9000` and it succeeded connecting via these ports only: 8080, 8090, 8091, 8200. Others might be blocked by the router? (The router only showed 8883 open in that range.) 

`curl -sv --max-time 5 http://<speaker-ip>:8xxx/ 2>&1 | tail -5` gave  positive answers (8091 and 8200 --> HTTP 404 not found). Could I use one of these ports instead of 8181 for your admin?

BTW, `./scripts/ssh-speaker.sh <speaker-ip> 'nc -l -p 8xxx'`  returned immediately `nc: bind: Address already in use` for the 4 "open" ports above. 

I might try a different router if I can get the speaker connected to the other WLAN easily. Maybe that router doesn't block as many LAN ports between devices.

**Reply by skarl** [reply]
Hey @DavidB-123 — your scan results pretty much settle it. Your router permits exactly the ports the Bose firmware advertises at startup (8080, 8090, 8091, 8200) and silently drops the rest between LAN clients, including all the alt-HTTP ports we tested. You also can't bind our admin to any of the four working ports because they're already in use by stock Bose daemons — the kernel won't let two processes share. So from the speaker side, there's nothing more we can change that would make the admin reachable on your current network.

That leaves the fix on the network side, and that's honestly past what I can helpfully chase remotely. I'm running this project solo with one SoundTouch 10 on my desk, so once we cross into a specific router's filtering behaviour on hardware I can't see, I'd mostly be guessing — and you've already done a more thorough job poking at it than I could. Two things you suggested yourself are probably your best shots: moving the speaker to your second router (different vendor / firmware = different defaults, decent chance the filter just isn't there), or digging for an "AP isolation," "device sandboxing," or similar advanced setting in the main router's admin UI. If you do find the setting, I'd love to know which it was — useful datapoint for anyone else who hits this.

On the project side, I'll still ship the `--port` option in `scripts/deploy.sh` so users on routers with simpler port-specific filters have an easy workaround, and add a troubleshooting entry that points at this exact failure shape (verify says healthy, admin doesn't load in the browser → look at your router's LAN-client filtering). Your reports made both of those obviously worth doing, so genuinely thank you for that. Have a good one.

**Reply by DavidB-123** [reply]
Hi @skarl, I did some further digging: 
1. I connected the speaker to my other router which doesn't have any (obvious) settings that would limit the ports (like the other router). Same behavior, no access to the speaker on port 8181. 
2. For testing, I started a http server on my Linux PC on port 8181 and was able to connect to it via the browser on my iPad. This also worked with other ports. And I could connect to a test http server on a Raspberry Pi from PC and iPad (on several ports including 8181) which worked as well.  I think this proves that my router is not blocking the ports. 
3. I found the [AfterTouch](https://github.com/gesellix/Bose-SoundTouch) project in GH that [describes the same problem](https://github.com/gesellix/Bose-SoundTouch/blob/main/docs/content/docs/guides/ON-DEVICE-INSTALL-WALKTHROUGH.md) accessing a webserver installed on the speaker. Apparently, a problem with some speaker firmware versions (mine is 27.0.6.46330.5043500). They use a SSH tunnel as workaround!
4. So I did the same thing: running `ssh -oHostKeyAlgorithms=+ssh-rsa -L 8181:localhost:8181 root@<speaker-IP>` and opened `http://localhost:8181` in a web browser on the same PC ... and the admin loads! 
5. Now the next problem: I see the admin page with the correct presets showing for a few seconds before "Speaker isn't responding - Bo accepted the request but did not finish in time. The speaker may be busy or briefly unreachable." pops up, then disappearing and popping up again a couple of times, then the pop-up stays and doesn't react anymore. In the terminal with the tunnel command I see the repeated message "accept: Too many open files". After a minute or two so the speaker reboots by itself or hangs up. I tried it a few times. Speaker and PC were connected to the same router. I wonder if this is caused by the tunnel trick or anything else.

**Comment by skarl** [comment]
Hey @DavidB-123 — this is genuinely brilliant detective work, thank you. You did three things I couldn't do from here: ruled out your router for good (the PC + Pi test on :8181 is airtight), dug up the AfterTouch tunnel trick, and proved it loads. That whole first half of the problem — solved by you.

On *why* :8181 is blocked: I went and dug rather than guess. I pulled my own ST 10 and it's on the exact same firmware as yours (`27.0.6.46330.5043500`), and on mine :8181 is reachable straight off the LAN, no tunnel. So it's not the firmware, and it's not a bug in our resolver — it's something specific to your unit. (Small thing your `/info` cleared up, by the way: you've actually got a SoundTouch **Portable**, variant `taigan` — not an ST 20 like we'd both been assuming.) I'll be honest: I don't have a proven reason *why* the Portable drops :8181 while letting 8080/8090 through, and I'm not going to hand-wave one. The tunnel is the right workaround. (If you ever get curious, one `tcpdump` on your *laptop* while curling :8181 would show where that instant "connection refused" is coming from — but the tunnel works for you, so totally optional.)

Now the crash — *that* one I can explain, because it's our code. The admin gets its live updates over a WebSocket on **port 8080**, and your tunnel only forwards 8181. So the socket can never connect, and the admin falls back to *polling* the speaker every 2 seconds — and each poll fans out into ~14 requests at once, all squeezed through your one tunnel. A little embedded box runs out of file handles fast (your `accept: Too many open files`), the requests start timing out (the "isn't responding" popups), and eventually it tips over.

One extra forward fixes it — tunnel 8080 too:

```sh
ssh -oHostKeyAlgorithms=+ssh-rsa -L 8181:localhost:8181 -L 8080:localhost:8080 root@<your-speaker-IP>
```

Then open `http://localhost:8181` like before. With 8080 forwarded the WebSocket connects, the admin stops polling, and the hammering should stop.

Honest caveat: you mentioned a while back that the speaker also rebooted once during plain radio playback with nothing open — so I can't promise this kills *every* reboot, just the tunnel-storm one. If it still misbehaves after this, shout and we'll chase that one separately.

I'm also putting out a small update (0.8.3) that documents this tunnel path properly and makes the admin back off instead of hammering the speaker when it can't reach the socket — so nobody else trips the same wire. Your reports drove all of it. Cheers m8, and thanks again for the patience. =)

**Reply by DavidB-123** [reply]
Hi @skarl, the "double tunnel" for 8080 and 8181 works and I can open and use the admin - thanks! Occasionally, I still see the "isn't responding"-pop-ups because I haven't updated the admin to the latest version on my speaker yet. Should I uninstall it first or is over-installation ok?

Regarding the root cause analysis for the inability to reach my speaker on port 8181 directly, what would be the `tcpdump` command I need to run on my PC? (I'm not familiar with this ;-) 

So far, your resurrect works fine! No spontaneous reboots recently. Occasionally, the audio (TuneIn preset) sounds a bit laggy for a couple of seconds, this comes and goes. Not sure this has anything to do with this project since the resolver is not involved in the audio stream itself (if I understand correctly). We have a fiber connection, so the internet connection shouldn't be a bottleneck. Just wondering if you heard about this before.
Best regards and I'm happy to help advancing this great project if I can. Cheers!

**Reply by skarl** [reply]
Hi @DavidB-123 — glad the double tunnel sorted it, and good to hear it's been steady otherwise. Taking your three in turn:

**1. Updating the admin — over-install is fine, but heads-up on the verify step.**
No need to uninstall first. Just re-run `admin/deploy.sh <speaker-ip>`; it overwrites in place (it even wipes and recreates the `app/` dir on the speaker) and never touches the resolver, so there's nothing to clean up.

One catch specific to your unit, so it doesn't alarm you: the final step in the script is to curl `http://<speaker>:8181/` from your laptop to confirm the page is up — which is the one request your speaker blocks. So the script will end by **exiting with an error** — the same `no response from http://…:8181/` you saw at the very start of this thread. On your unit that's expected and **does not mean the update failed**: all the files are pushed over SSH/SCP well before that final check runs. To confirm it actually updated, bring up your double tunnel and hard-refresh `http://localhost:8181` (Ctrl/Cmd+Shift+R). Being on the latest admin also gets you the 0.8.3 polling back-off, so even a hiccup on the 8080 tunnel won't storm the speaker the way it did before.

**2. The tcpdump, if you're curious.**
Honest heads-up first: I still can't promise a root cause from here — your unit refuses `:8181` while my identical-firmware ST 10 doesn't, which is genuinely odd. But here's how *you* can look. On your Linux PC (no tunnel — this tests the direct, blocked path), with the speaker on the same router:

```sh
sudo tcpdump -ni any host 192.168.1.112 and '(tcp port 8181 or tcp port 8090)'
```

Then in a second terminal, poke a port that works and the one that doesn't, back to back:

```sh
curl -sv --max-time 5 http://192.168.1.112:8090/info >/dev/null
curl -sv --max-time 5 http://192.168.1.112:8181/ >/dev/null
```

`tcpdump` prints a line per packet. On `:8090` you'll see your `[S]` (SYN) go out and an `[S.]` (SYN-ACK) come back — a normal handshake. On `:8181` you'll either see your `[S]` go out and an `[R]`/`[R.]` (reset) come straight back — and **the source IP on that reset line is the interesting bit** (is it the speaker `.112` refusing, or another box on the path?) — or your SYN leaves and *nothing* comes back (silently dropped). Paste the `:8181` lines and I'll take a look, but no pressure: the tunnel already gets you a working admin.

One concrete lead while you're in there: there's a [documented SoundTouch quirk](https://dere.la/posts/bose-soundtouch-cross-vlan/) where the speaker silently drops packets that arrive from a *different* subnet/VLAN, even with an empty firewall. Some of your earlier tests had the PC on `192.168.0.x` reaching the speaker on `192.168.1.x` through your second router — exactly that cross-subnet shape. It doesn't explain everything you saw, but it's worth making sure the PC and the speaker are on the same subnet (same `192.168.1.x`) when you run the capture, to rule it out cleanly.

**3. The occasional TuneIn lag.**
You've got it exactly right: the resolver only hands the speaker a stream URL at tune time; once audio is playing it streams straight from the station's CDN and the resolver — and this whole project — is out of the path (`docs/architecture.md` spells that out). So a couple of seconds of intermittent lag isn't something this sits in front of. It's *typically* stream-side — the station's own CDN buffering or re-buffering on that particular stream, which can happen regardless of how fat your own connection is. I haven't had a report tying it to resurrect. If it ever pins to one *specific* preset, mention which station and I'll glance at it.

Really appreciate the offer to help — the detective work you've already done drove the whole 0.8.3 round of changes. Cheers!
